{
  "schema_version": "0.1",
  "generated_at": "2026-09-17T22:34:44.532Z",
  "generator": {
    "name": "@webtestagent/dsh-graph-explorer",
    "version": "0.1.22",
    "command": "@webtestagent/dsh-graph-explorer 0.1.22 graph_commit",
    "notes": "Assembled by graph_commit from an exploration run. Raw evidence in observations.jsonl is unchanged; this file is derived and can be rebuilt."
  },
  "application": {
    "id": "app_acme-demo",
    "name": "Acme Demo App",
    "base_url": "http://127.0.0.1:4173/",
    "metadata": {
      "status": "verified",
      "producer": "manual",
      "created_at": "2026-09-17T22:34:08.644Z",
      "extra": {
        "declared": {
          "id": "plugin config `application.id`",
          "name": "plugin config `application.name`"
        },
        "observed": {
          "base_url": "run.json `start_url`"
        },
        "note": "The identity is declared, never derived: the start URL is where this walk happened, not what the application is."
      }
    }
  },
  "features": [
    {
      "id": "feature_authentication",
      "name": "authentication",
      "capabilities": [
        "cap_fill_login_email",
        "cap_fill_login_password",
        "cap_submit_login",
        "cap_login"
      ],
      "states": [
        "state_login_anonymous",
        "state_project_list_authenticated_projects_populated"
      ],
      "transitions": [
        "transition_fill_login_email",
        "transition_fill_login_password",
        "transition_submit_login"
      ],
      "journeys": [
        "journey_login_anonymous_to_project_list_authenticated_projects_popu"
      ],
      "metadata": {
        "status": "inferred",
        "producer": "llm:deepseek-flash",
        "created_at": "2026-09-17T22:34:08.644Z",
        "extra": {
          "declared": {
            "name": "authentication — the model's own word, claimed on the step(s) transition_fill_login_email, transition_fill_login_password, transition_submit_login",
            "claimed_by": "graph_transition `feature` argument"
          },
          "observed": {
            "transitions": 3,
            "capabilities": 3,
            "states": 2,
            "journeys": 1,
            "apis": 0
          },
          "derived_from": "the transitions whose step records claimed this name: their capabilities, the states they join, the walks that contain them, the endpoints they called",
          "id_from": "slugify(\"authentication\") → feature_authentication",
          "related_features": "not set: which features change together is the model's judgement and nothing in the evidence implies it",
          "user_value": "not set: why this feature exists for the user is prose nothing in a browser session supplies",
          "note": "the name is the model's; the membership was derived from the evidence of 3 step(s) and can be re-derived from this graph alone."
        }
      }
    }
  ],
  "capabilities": [
    {
      "id": "cap_fill_login_email",
      "name": "fill_login_email",
      "description": "Type the account email into the sign-in form.",
      "kind": "interaction",
      "input": {
        "email": {
          "type": "string",
          "required": true
        }
      },
      "evidence": [
        {
          "observation": "obs_0001",
          "role": "identity"
        },
        {
          "observation": "obs_0002",
          "role": "action"
        },
        {
          "observation": "obs_0002",
          "role": "effect"
        }
      ],
      "metadata": {
        "status": "verified",
        "producer": "llm:deepseek-flash",
        "confidence": 1,
        "created_at": "2026-09-17T22:34:24.726Z",
        "extra": {
          "commit": {
            "decision": "committed",
            "attempts": 1,
            "committed_edges": 1
          },
          "vocabulary_notes": [
            {
              "signal": "overlapping_words",
              "you_said": "fill_login_email",
              "vocabulary_name": "login",
              "relation": "broader_than",
              "detail": "\"fill_login_email\" contains the words of \"login\" (which already exists). They may be one behaviour described two ways. Reuse \"login\" if they are."
            }
          ],
          "composed_of_names": [],
          "kind_recorded_by_a_later_composition": false,
          "minted_by": "graph_transition (first use of the name)"
        }
      }
    },
    {
      "id": "cap_login",
      "name": "login",
      "kind": "composite",
      "composed_of": [
        "cap_fill_login_email",
        "cap_fill_login_password",
        "cap_submit_login"
      ],
      "metadata": {
        "status": "inferred",
        "producer": "llm:deepseek-flash",
        "confidence": 0.5,
        "created_at": "2026-09-17T22:34:24.726Z",
        "extra": {
          "commit": {
            "decision": "inferred",
            "attempts": 0,
            "committed_edges": 0
          },
          "vocabulary_notes": [],
          "composed_of_names": [
            "fill_login_email",
            "fill_login_password",
            "submit_login"
          ],
          "kind_recorded_by_a_later_composition": false,
          "minted_by": "graph_transition (first use of the name)"
        }
      }
    },
    {
      "id": "cap_fill_login_password",
      "name": "fill_login_password",
      "description": "Type the account password into the sign-in form; the collector records the value as [set].",
      "kind": "interaction",
      "input": {
        "password": {
          "type": "string",
          "required": true
        }
      },
      "evidence": [
        {
          "observation": "obs_0002",
          "role": "identity"
        },
        {
          "observation": "obs_0003",
          "role": "action"
        },
        {
          "observation": "obs_0003",
          "role": "effect"
        }
      ],
      "metadata": {
        "status": "verified",
        "producer": "llm:deepseek-flash",
        "confidence": 1,
        "created_at": "2026-09-17T22:34:31.750Z",
        "extra": {
          "commit": {
            "decision": "committed",
            "attempts": 1,
            "committed_edges": 1
          },
          "vocabulary_notes": [
            {
              "signal": "overlapping_words",
              "you_said": "fill_login_password",
              "vocabulary_name": "login",
              "relation": "broader_than",
              "detail": "\"fill_login_password\" contains the words of \"login\" (which already exists). They may be one behaviour described two ways. Reuse \"login\" if they are."
            }
          ],
          "composed_of_names": [],
          "kind_recorded_by_a_later_composition": false,
          "minted_by": "graph_transition (first use of the name)"
        }
      }
    },
    {
      "id": "cap_submit_login",
      "name": "submit_login",
      "description": "Submit the sign-in form; the app authenticates the user and shows the project list.",
      "kind": "interaction",
      "evidence": [
        {
          "observation": "obs_0003",
          "role": "identity"
        },
        {
          "observation": "obs_0004",
          "role": "action"
        },
        {
          "observation": "obs_0004",
          "role": "effect"
        }
      ],
      "metadata": {
        "status": "verified",
        "producer": "llm:deepseek-flash",
        "confidence": 1,
        "created_at": "2026-09-17T22:34:43.288Z",
        "extra": {
          "commit": {
            "decision": "committed",
            "attempts": 1,
            "committed_edges": 1
          },
          "vocabulary_notes": [
            {
              "signal": "overlapping_words",
              "you_said": "submit_login",
              "vocabulary_name": "login",
              "relation": "broader_than",
              "detail": "\"submit_login\" contains the words of \"login\" (which already exists). They may be one behaviour described two ways. Reuse \"login\" if they are."
            }
          ],
          "composed_of_names": [],
          "kind_recorded_by_a_later_composition": false,
          "minted_by": "graph_transition (first use of the name)"
        }
      }
    }
  ],
  "states": [
    {
      "id": "state_login_anonymous",
      "identity": {
        "route": "/",
        "page_type": "login",
        "variant": "anonymous"
      },
      "description": "The Acme sign-in screen with email, password, remember-me and a Sign in button.",
      "elements": [
        {
          "id": "element_email_input",
          "role": "textbox",
          "name": "Email",
          "semantic": {
            "purpose": "email_input"
          },
          "locator": {
            "strategy": "testid",
            "value": "email-input"
          },
          "metadata": {
            "status": "verified",
            "producer": "playwright",
            "created_at": "2026-09-17T22:34:15.291Z",
            "extra": {
              "observed_in": "state_login_anonymous",
              "raw_locator": "[data-testid=\"email-input\"]"
            }
          }
        },
        {
          "id": "element_password_input",
          "role": "textbox",
          "name": "Password",
          "semantic": {
            "purpose": "password_input"
          },
          "locator": {
            "strategy": "testid",
            "value": "password-input"
          },
          "metadata": {
            "status": "verified",
            "producer": "playwright",
            "created_at": "2026-09-17T22:34:15.291Z",
            "extra": {
              "observed_in": "state_login_anonymous",
              "raw_locator": "[data-testid=\"password-input\"]"
            }
          }
        },
        {
          "id": "element_remember_checkbox",
          "role": "checkbox",
          "name": "Remember me",
          "semantic": {
            "purpose": "remember_checkbox"
          },